{
  "development": true,
  "ip_preparation": "127.0.0.1",
  "port_preparation": 5002,
  "ip_segregation": "188.217.91.69",
  "port_segregation": 5003,
  "ip_production": "109.116.135.145",
  "port_production": 5005,
  "MinDecibelGain": -20,
  "MaxDecibelGain": 5,
  "stopWordList": [
    "a",
    "about",
    "above",
    "after",
    "again",
    "against",
    "all",
    "am",
    "an",
    "and",
    "any",
    "are",
    "aren't",
    "as",
    "at",
    "be",
    "because",
    "been",
    "before",
    "being",
    "below",
    "between",
    "both",
    "but",
    "by",
    "can't",
    "cannot",
    "could",
    "couldn't",
    "did",
    "didn't",
    "do",
    "does",
    "doesn't",
    "doing",
    "don't",
    "down",
    "during",
    "each",
    "few",
    "for",
    "from",
    "further",
    "had",
    "hadn't",
    "has",
    "hasn't",
    "have",
    "haven't",
    "having",
    "he",
    "he'd",
    "he'll",
    "he's",
    "her",
    "here",
    "here's",
    "hers",
    "herself",
    "him",
    "himself",
    "his",
    "how",
    "i",
    "i'd",
    "i'll",
    "i'm",
    "i've",
    "if",
    "in",
    "into",
    "is",
    "isn't",
    "it",
    "it's",
    "its",
    "itself",
    "just",
    "ll"
  ],
  "features":["badWords", "tweetLength", "audioDecibels", "matchEvents"]
}